{
  "$schema": "https://json-schema.org/draft/2020-12/schema",
  "$id": "https://roaringlions.dev/schemas/vfx_emitter.schema.json",
  "title": "VFX Emitter",
  "description": "Data-driven particle emitter. VFX are the highest-value visual work in this project and they are pure data + code, so contributors can add them without touching the engine or shipping any art. Emitters are triggered by sim events; the emitter itself is PRESENTATION ONLY and must never feed back into the deterministic sim.",
  "type": "object",
  "required": [
    "id",
    "trigger",
    "layer",
    "particles"
  ],
  "additionalProperties": false,
  "properties": {
    "id": {
      "type": "string",
      "pattern": "^[a-z0-9_]+$"
    },
    "trigger": {
      "description": "What spawns this emitter. Every value but `ambient_idle` is a sim event. `ambient_idle` is presentation-only: the renderer spawns it on its own timer for units showing the idle clip, seeded from the presentation PRNG. It exists because idling is not an event and must not become one -- putting a cigarette in the deterministic simulation would widen the state the replay hash covers for something no outcome depends on. The renderer reads sim state and writes none, so invariant 4 holds.",
      "type": "string",
      "enum": [
        "weapon_fire",
        "projectile_trail",
        "impact_terrain",
        "impact_armor",
        "penetration",
        "catastrophic_kill",
        "mobility_kill",
        "vehicle_move",
        "rotor_wash",
        "structure_collapse",
        "tunnel_collapse",
        "interceptor_launch",
        "interceptor_hit",
        "suppression_near_miss",
        "eod_breach",
        "smoke_screen",
        "flare",
        "ambient_idle"
      ]
    },
    "layer": {
      "type": "string",
      "enum": [
        "ground_decal",
        "below_units",
        "above_units",
        "sky"
      ],
      "description": "ground_decal is persistent battlefield state -- scorch, craters, rubble. Persistence is what makes a map look fought-over instead of freshly loaded."
    },
    "persistent": {
      "type": "boolean",
      "default": false,
      "description": "If true, survives for the remainder of the mission. Only valid on ground_decal."
    },
    "budget_priority": {
      "type": "integer",
      "minimum": 0,
      "maximum": 10,
      "default": 5,
      "description": "Culled first when the particle budget is exceeded. Muzzle flashes should outrank ambient dust."
    },
    "screen_shake": {
      "type": "object",
      "description": "A camera jolt for a BLAST, not a property every emitter has. The renderer reads it on four events only: a building collapse (structure_collapse), a vehicle kill (catastrophic_kill), a shell landing (shell_impact) and a missile impact (missile_impact), each scaled by that event's own power. Firing never shakes the screen, so a weapon_fire emitter does not author one (polish VR-23). Strength is ranked by event: collapse > vehicle kill > shell landing > muzzle flash, for shake, hit_stop_ms and light alike (VR-22).",
      "additionalProperties": false,
      "properties": {
        "amplitude_px": {
          "type": "number",
          "minimum": 0,
          "maximum": 24
        },
        "duration_ms": {
          "type": "integer",
          "minimum": 0,
          "maximum": 1200
        },
        "falloff_tiles": {
          "type": "number",
          "minimum": 0
        }
      }
    },
    "hit_stop_ms": {
      "type": "integer",
      "minimum": 0,
      "maximum": 120,
      "default": 0,
      "description": "Presentation-layer freeze on impact. Sells weight. Never applied to the sim clock."
    },
    "light": {
      "type": "object",
      "description": "Transient light contribution. This is what makes muzzle flashes read at night and in thermal.",
      "additionalProperties": false,
      "properties": {
        "color": {
          "$ref": "#/$defs/palette_ref"
        },
        "intensity": {
          "type": "number",
          "minimum": 0
        },
        "radius_tiles": {
          "type": "number",
          "minimum": 0
        },
        "decay_ms": {
          "type": "integer",
          "minimum": 0
        }
      }
    },
    "weapon_classes": {
      "type": "array",
      "minItems": 1,
      "uniqueItems": true,
      "description": "Weapon classes this emitter serves, matched against WEAPON_CLASS in @lions/sim. Only meaningful when trigger is weapon_fire. Mirrors the audio manifest's weapon_classes field so presentation uses one vocabulary.",
      "items": {
        "type": "string",
        "enum": [
          "apfsds",
          "heat",
          "he",
          "atgm",
          "rpg",
          "small_arms",
          "hmg",
          "autocannon",
          "mortar",
          "rocket",
          "interceptor",
          "demolition"
        ]
      }
    },
    "flipbook": {
      "type": "array",
      "minItems": 1,
      "description": "Three only (Defilade T4): an instanced, GPU-aged billboard recipe drawn by `FlipbookFx.spawnRecipe` (`packages/render/src/three/units/flipbook-fx.ts`), sampling the baked fire and smoke atlases. When an emitter declares one, it supersedes that emitter's `mesh_burst` and `mesh_plume` layers and its `smoke_puff` layers on shell impacts, vehicle kills, missile impacts and main-gun muzzles (D6); shards, lights, shake and hit-stop are untouched. Layer 0's `base + per_power * power` is the recipe's FIREBALL scale, which a later layer may scale from (`scale_from`). Presentation only: randomness comes from the flipbook's own presentation PRNG, never the sim.",
      "items": {
        "$ref": "#/$defs/flipbook_layer"
      }
    },
    "particles": {
      "type": "array",
      "minItems": 1,
      "items": {
        "$ref": "#/$defs/particle_layer"
      }
    }
  },
  "$defs": {
    "palette_ref": {
      "type": "string",
      "description": "Palette key, e.g. 'vfx.fire' or 'dust.2'. Raw hex is rejected by CI -- the palette is the reason the game looks cohesive.",
      "pattern": "^[a-z_]+\\.[a-z0-9_]+$"
    },
    "range": {
      "type": "array",
      "items": {
        "type": "number"
      },
      "minItems": 2,
      "maxItems": 2,
      "description": "[min, max], sampled from the seeded presentation PRNG."
    },
    "particle_layer": {
      "type": "object",
      "required": [
        "count",
        "lifetime_ms",
        "color_over_life"
      ],
      "additionalProperties": false,
      "properties": {
        "sprite": {
          "type": "string",
          "default": "soft_dot",
          "enum": [
            "soft_dot",
            "hard_dot",
            "streak",
            "smoke_puff",
            "spark",
            "shard",
            "ring"
          ],
          "description": "A `smoke_puff` layer is superseded by `flipbook` on three when the emitter declares one (Defilade T4, D6); it stays declared as the fallback."
        },
        "count": {
          "$ref": "#/$defs/range"
        },
        "lifetime_ms": {
          "$ref": "#/$defs/range"
        },
        "emit_over_ms": {
          "type": "integer",
          "default": 0,
          "description": "0 = burst. >0 = sustained emission, for trails and fires."
        },
        "speed_tiles_s": {
          "$ref": "#/$defs/range"
        },
        "cone_deg": {
          "type": "number",
          "minimum": 0,
          "maximum": 360,
          "default": 360
        },
        "direction_offset_deg": {
          "type": "number",
          "minimum": -180,
          "maximum": 180,
          "default": 0,
          "description": "Rotates this layer's emission direction relative to the emitter's facing. 180 emits directly backwards -- an RPG or ATGM backblast, which is what identifies an AT team by the shape of its signature alone."
        },
        "inherit_velocity": {
          "type": "number",
          "minimum": 0,
          "maximum": 1,
          "default": 0
        },
        "gravity_tiles_s2": {
          "type": "number",
          "default": 0
        },
        "drag": {
          "type": "number",
          "minimum": 0,
          "maximum": 1,
          "default": 0
        },
        "size_px": {
          "$ref": "#/$defs/range"
        },
        "size_over_life": {
          "type": "array",
          "items": {
            "type": "number",
            "minimum": 0
          },
          "minItems": 2,
          "description": "Multiplier curve sampled across lifetime."
        },
        "color_over_life": {
          "type": "array",
          "minItems": 1,
          "items": {
            "$ref": "#/$defs/palette_ref"
          },
          "description": "Stepped, not interpolated -- interpolation would generate off-palette colours. white_hot -> fire -> ember -> dust.3 is the canonical explosion ramp."
        },
        "alpha_over_life": {
          "type": "array",
          "items": {
            "type": "number",
            "minimum": 0,
            "maximum": 1
          },
          "minItems": 2
        },
        "additive": {
          "type": "boolean",
          "default": false,
          "description": "Marks this layer as a hot, opaque core -- the three.js backend renders it fully opaque (alpha_over_life is ignored; the fragment always writes alpha 1.0) rather than fading it, so it reads as a solid patch of its resolved colour instead of diluting toward whatever is behind it. Reserve for vfx.white_hot-class effects (muzzle flashes, explosion cores). NOT a GPU additive/summing blend mode despite the name: overlapping additive particles do not sum brighter than a single one -- true additive blending was tried and rejected because it sums to colours no palette entry names (see packages/render/src/three/units/fx.ts's createParticleMaterial doc comment). Build a white-to-orange-to-red-orange grade by layering separate particle layers spatially (see fire_apfsds.json), not by relying on this field to blend one layer's colour past the palette."
        },
        "heat_shimmer": {
          "type": "boolean",
          "default": false,
          "description": "Screen-space distortion pass. Reserve for burning wrecks and jet wash."
        },
        "mesh_flash": {
          "type": "boolean",
          "default": false,
          "description": "Three.js backend only, and only once art/meshes/vfx/muzzle_flash.glb has loaded (the &mesh flag): this layer is superseded by a pooled, modelled flash mesh instead of being spawned as a particle. Falls back to the authored particle exactly as declared when the mesh has not loaded (mesh flag off, still loading, or the Pixi backend, which never reads this field). Reserve for a hot-core layer a modelled asset can shape better than stacked discs -- see packages/render/src/three/units/muzzle-flash.ts's own top comment."
        },
        "mesh_burst": {
          "type": "boolean",
          "default": false,
          "description": "Three.js backend only, and only once art/meshes/vfx/explosion_burst.glb has loaded (the &mesh flag): this layer is superseded by a pooled, modelled explosion-fireball mesh instead of being spawned as a particle. Falls back to the authored particle exactly as declared when the mesh has not loaded (mesh flag off, still loading, or the Pixi backend, which never reads this field). The mesh_flash sibling field, for a structure_collapse/tunnel_collapse-triggered hot core rather than a weapon_fire one -- see packages/render/src/three/units/explosion-burst.ts's own top comment for why this attaches to structure_collapse specifically. Superseded by `flipbook` on three when the emitter declares one (Defilade T4, D6); the layer stays declared as the fallback."
        },
        "mesh_plume": {
          "type": "boolean",
          "default": false,
          "description": "Three.js backend only, and only once art/meshes/vfx/smoke_plume.glb has loaded (the &mesh flag): this layer is superseded by a pooled, modelled rising smoke column instead of being spawned as a particle. Falls back to the authored particle exactly as declared when the mesh has not loaded (mesh flag off, still loading, or the Pixi backend, which never reads this field). The mesh_burst sibling field, for the multi-second smoke aftermath of a structure_collapse (or a hard-target unit death) rather than the sub-second fireball itself -- see packages/render/src/three/units/smoke-plume.ts's own top comment. Superseded by `flipbook` on three when the emitter declares one (Defilade T4, D6); the layer stays declared as the fallback."
        }
      }
    },
    "flipbook_layer": {
      "type": "object",
      "description": "One layer of a flipbook recipe: `count` instances of one billow type. `k` below is the instance index within the layer (0-based) and `power` the event's power; every [min, max] is sampled from the presentation PRNG (a range with min = max draws nothing).",
      "required": [
        "type",
        "count",
        "delay_ms",
        "duration_ms",
        "scale",
        "velocity"
      ],
      "additionalProperties": false,
      "properties": {
        "type": {
          "type": "string",
          "enum": [
            "fire",
            "smoke",
            "dirt",
            "spark"
          ],
          "description": "fire: HDR fireball cooling to soot (drawn over the hull, not depth-tested). smoke: lit soot or dust, drifting. dirt: a ballistic kick-up in the ground's dust tones. spark: an HDR ember dot thrown ballistically, cooling from white-hot to ember, drawn in the fire pass and settling on the ground."
        },
        "count": {
          "type": "integer",
          "minimum": 1,
          "maximum": 64
        },
        "delay_ms": {
          "type": "array",
          "items": {
            "type": "number",
            "minimum": 0
          },
          "minItems": 2,
          "maxItems": 2,
          "description": "[base, per_index]: instance k starts base + per_index * k ms after the event. Not a range."
        },
        "duration_ms": {
          "type": "array",
          "items": {
            "type": "number",
            "exclusiveMinimum": 0
          },
          "minItems": 2,
          "maxItems": 2,
          "description": "[min, max] life, ms."
        },
        "scale": {
          "type": "object",
          "additionalProperties": false,
          "required": [
            "base"
          ],
          "description": "Billow size in world units: base + per_power * power + per_index_power * k * power + rand * U(0, 1), times the recipe's fireball scale when `scale_from` is `fireball`.",
          "properties": {
            "base": {
              "type": "number"
            },
            "per_power": {
              "type": "number"
            },
            "per_index_power": {
              "type": "number"
            },
            "rand": {
              "type": "number",
              "minimum": 0
            }
          }
        },
        "scale_from": {
          "type": "string",
          "enum": [
            "fireball"
          ],
          "description": "Multiply `scale` by layer 0's base + per_power * power."
        },
        "velocity": {
          "type": "object",
          "additionalProperties": false,
          "required": [
            "radial",
            "up"
          ],
          "description": "Initial velocity, world units per second.",
          "properties": {
            "radial": {
              "$ref": "#/$defs/range",
              "description": "Horizontal speed away from the origin, at a random heading -- or, with `ring`, at heading 2 pi k / count."
            },
            "up": {
              "$ref": "#/$defs/range",
              "description": "Vertical speed."
            },
            "along_bore": {
              "$ref": "#/$defs/range",
              "description": "Speed along the caller's bore direction, added to the radial part (muzzles)."
            },
            "ring": {
              "type": "boolean",
              "description": "Space the headings evenly around a ring instead of at random."
            },
            "ring_jitter_rad": {
              "type": "number",
              "minimum": 0,
              "description": "With `ring`: add U(0, this) radians to each heading."
            }
          }
        },
        "offset": {
          "type": "object",
          "additionalProperties": false,
          "description": "Where the instance starts, relative to the event's origin.",
          "properties": {
            "up": {
              "type": "number"
            },
            "along_bore": {
              "type": "number",
              "description": "Along the bore, + forward (a muzzle's ground blast sits behind it: negative)."
            },
            "along_bore_per_index": {
              "type": "number",
              "description": "Added per instance index k, along the bore."
            },
            "scatter": {
              "type": "number",
              "minimum": 0,
              "description": "A square of this side centred on the origin: x and z each get U(-scatter/2, scatter/2)."
            }
          }
        },
        "tint": {
          "type": "number",
          "minimum": 0,
          "maximum": 1,
          "description": "smoke only: 0 soot, 1 dust."
        },
        "oil": {
          "type": "number",
          "exclusiveMinimum": 0,
          "maximum": 1,
          "description": "smoke only: oily burning-fuel soot that stays near black for most of its life and glows ember in its dense core while young; overrides tint. Must be above 0: 0 cannot override tint (the code reads `L.oil ? -L.oil : ...`), so omit it instead."
        },
        "low_fraction": {
          "type": "number",
          "exclusiveMinimum": 0,
          "maximum": 1,
          "description": "At the lowest effects detail (quality fxDetail 0) only this fraction of `count` (rounded up) is spawned. Absent: the full count. A `spark` layer is dropped outright at that tier."
        },
        "at_ground": {
          "type": "boolean",
          "description": "Start at the caller's ground height rather than the event's origin height."
        }
      }
    }
  }
}
