{
  "id": "vehicle_damaged_smoke",
  "trigger": "mobility_kill",
  "layer": "above_units",
  "budget_priority": 2,
  "particles": [
    {
      "sprite": "smoke_puff",
      "count": [1, 1],
      "lifetime_ms": [1600, 2200],
      "emit_over_ms": 600,
      "speed_tiles_s": [0.08, 0.18],
      "cone_deg": 18,
      "gravity_tiles_s2": -0.35,
      "drag": 0.6,
      "size_px": [4, 7],
      "size_over_life": [0.5, 1.2, 2.0],
      "color_over_life": ["shadow.0", "gunmetal.3", "gunmetal.2"],
      "alpha_over_life": [0.55, 0.35, 0.0]
    }
  ]
}
