{
  "id": "air_strike_impact",
  "trigger": "impact_terrain",
  "layer": "above_units",
  "budget_priority": 9,
  "hit_stop_ms": 40,
  "screen_shake": {
    "amplitude_px": 5,
    "duration_ms": 520,
    "falloff_tiles": 14
  },
  "light": {
    "color": "vfx.fire",
    "intensity": 4.2,
    "radius_tiles": 7,
    "decay_ms": 520
  },
  "flipbook": [
    {
      "type": "fire",
      "count": 1,
      "delay_ms": [
        0,
        0
      ],
      "duration_ms": [
        1100,
        1100
      ],
      "scale": {
        "base": 0.8,
        "per_power": 1.4
      },
      "velocity": {
        "radial": [
          0,
          0
        ],
        "up": [
          0.3,
          0.3
        ]
      }
    },
    {
      "type": "fire",
      "count": 6,
      "delay_ms": [
        0,
        20
      ],
      "duration_ms": [
        900,
        1200
      ],
      "scale": {
        "base": 0.6
      },
      "scale_from": "fireball",
      "velocity": {
        "radial": [
          2.0,
          2.0
        ],
        "up": [
          0.8,
          2.2
        ],
        "ring": true,
        "ring_jitter_rad": 1
      }
    },
    {
      "type": "dirt",
      "count": 27,
      "delay_ms": [
        0,
        10
      ],
      "duration_ms": [
        800,
        1200
      ],
      "scale": {
        "base": 0.32,
        "per_power": 0.32,
        "rand": 0.34
      },
      "velocity": {
        "radial": [
          0.4,
          1.4
        ],
        "up": [
          3.0,
          5.5
        ]
      }
    },
    {
      "type": "smoke",
      "count": 15,
      "delay_ms": [
        150,
        80
      ],
      "duration_ms": [
        5700,
        8400
      ],
      "scale": {
        "base": 0.79,
        "per_power": 0.94,
        "rand": 0.4
      },
      "velocity": {
        "radial": [
          0.6,
          0.6
        ],
        "up": [
          0.3,
          0.6
        ]
      },
      "tint": 0.4
    }
  ],
  "particles": [
    {
      "sprite": "soft_dot",
      "count": [
        5,
        8
      ],
      "lifetime_ms": [
        200,
        340
      ],
      "speed_tiles_s": [
        1.6,
        3.6
      ],
      "cone_deg": 360,
      "gravity_tiles_s2": -0.8,
      "size_px": [
        6,
        11
      ],
      "size_over_life": [
        0.4,
        1.0,
        1.2
      ],
      "color_over_life": [
        "vfx.white_hot",
        "vfx.fire",
        "vfx.ember"
      ],
      "alpha_over_life": [
        1.0,
        0.9,
        0.0
      ],
      "additive": true,
      "mesh_burst": true
    },
    {
      "sprite": "shard",
      "count": [
        6,
        10
      ],
      "lifetime_ms": [
        280,
        620
      ],
      "speed_tiles_s": [
        1.2,
        3.2
      ],
      "cone_deg": 360,
      "gravity_tiles_s2": 2.5,
      "drag": 0.25,
      "size_px": [
        3,
        6
      ],
      "size_over_life": [
        1.0,
        0.6
      ],
      "color_over_life": [
        "dust.1",
        "dust.4"
      ],
      "alpha_over_life": [
        1.0,
        0.0
      ]
    },
    {
      "sprite": "smoke_puff",
      "count": [
        8,
        13
      ],
      "lifetime_ms": [
        700,
        1300
      ],
      "speed_tiles_s": [
        0.4,
        1.3
      ],
      "cone_deg": 360,
      "gravity_tiles_s2": -0.4,
      "drag": 0.8,
      "size_px": [
        8,
        15
      ],
      "size_over_life": [
        0.5,
        2.2
      ],
      "color_over_life": [
        "dust.2",
        "dust.4"
      ],
      "alpha_over_life": [
        0.75,
        0.0
      ]
    },
    {
      "sprite": "smoke_puff",
      "count": [
        3,
        5
      ],
      "lifetime_ms": [
        3200,
        4800
      ],
      "speed_tiles_s": [
        0.3,
        0.9
      ],
      "cone_deg": 360,
      "gravity_tiles_s2": -0.3,
      "drag": 0.5,
      "size_px": [
        16,
        28
      ],
      "size_over_life": [
        0.5,
        1.4,
        2.2
      ],
      "color_over_life": [
        "gunmetal.3",
        "gunmetal.2",
        "gunmetal.0"
      ],
      "alpha_over_life": [
        0.85,
        0.6,
        0.0
      ],
      "mesh_plume": true
    }
  ]
}
