{
  "id": "fire_mortar",
  "trigger": "weapon_fire",
  "layer": "above_units",
  "weapon_classes": ["mortar"],
  "budget_priority": 5,
  "light": { "color": "vfx.fire", "intensity": 0.9, "radius_tiles": 2.0, "decay_ms": 100 },
  "particles": [
    {
      "sprite": "soft_dot",
      "count": [2, 3],
      "lifetime_ms": [90, 150],
      "speed_tiles_s": [0.6, 1.4],
      "cone_deg": 90,
      "size_px": [4, 7],
      "size_over_life": [1.0, 0.4],
      "color_over_life": ["vfx.fire", "vfx.ember"],
      "alpha_over_life": [0.9, 0.0],
      "additive": true
    },
    {
      "sprite": "smoke_puff",
      "count": [4, 7],
      "lifetime_ms": [550, 900],
      "speed_tiles_s": [0.4, 1.0],
      "cone_deg": 360,
      "gravity_tiles_s2": -0.6,
      "drag": 0.7,
      "size_px": [7, 12],
      "size_over_life": [0.5, 2.0],
      "color_over_life": ["dust.3", "dust.2"],
      "alpha_over_life": [0.7, 0.0]
    }
  ]
}
