{
  "id": "missile_trail",
  "trigger": "projectile_trail",
  "layer": "above_units",
  "budget_priority": 6,
  "particles": [
    {
      "sprite": "soft_dot",
      "count": [1, 1],
      "lifetime_ms": [16, 16],
      "size_px": [2.5, 2.5],
      "color_over_life": ["vfx.white_hot"],
      "additive": true
    },
    {
      "sprite": "soft_dot",
      "count": [1, 1],
      "lifetime_ms": [16, 16],
      "size_px": [6, 6],
      "color_over_life": ["vfx.fire"],
      "alpha_over_life": [0.55, 0.55]
    },
    {
      "sprite": "smoke_puff",
      "count": [1, 1],
      "lifetime_ms": [4500, 4500],
      "size_px": [3.5, 3.5],
      "size_over_life": [1.0, 5.0],
      "color_over_life": ["limestone.0", "limestone.0", "gunmetal.0"],
      "alpha_over_life": [0.85, 0.0]
    }
  ]
}
