{
  "id": "structure_burning",
  "trigger": "ambient_idle",
  "layer": "above_units",
  "budget_priority": 3,
  "particles": [
    {
      "sprite": "spark",
      "count": [5, 8],
      "lifetime_ms": [220, 460],
      "speed_tiles_s": [0.6, 1.4],
      "cone_deg": 35,
      "gravity_tiles_s2": -2.5,
      "drag": 0.4,
      "size_px": [2, 4],
      "size_over_life": [0.7, 1.0, 0.3],
      "color_over_life": ["vfx.white_hot", "vfx.fire", "vfx.ember"],
      "alpha_over_life": [1.0, 0.7, 0.0],
      "additive": true
    },
    {
      "sprite": "smoke_puff",
      "count": [1, 1],
      "lifetime_ms": [2200, 3200],
      "speed_tiles_s": [0.2, 0.5],
      "cone_deg": 30,
      "gravity_tiles_s2": -0.5,
      "drag": 0.6,
      "size_px": [14, 24],
      "size_over_life": [0.5, 1.3, 2.0],
      "color_over_life": ["shadow.0", "gunmetal.2", "dust.3"],
      "alpha_over_life": [0.7, 0.45, 0.0],
      "mesh_plume": true
    }
  ]
}
