{
  "id": "catastrophic_kill",
  "trigger": "catastrophic_kill",
  "layer": "above_units",
  "budget_priority": 9,
  "hit_stop_ms": 70,
  "screen_shake": { "amplitude_px": 9, "duration_ms": 420, "falloff_tiles": 14 },
  "light": { "color": "vfx.fire", "intensity": 3.5, "radius_tiles": 7, "decay_ms": 500 },
  "flipbook": [
    { "type": "fire", "count": 1, "delay_ms": [0, 0], "duration_ms": [1500, 1500], "scale": { "base": 1.2, "per_power": 1.0 }, "velocity": { "radial": [0, 0], "up": [0.8, 0.8] }, "offset": { "up": 0.2 } },
    { "type": "fire", "count": 6, "delay_ms": [0, 15], "duration_ms": [1100, 1500], "scale": { "base": 0.8 }, "scale_from": "fireball", "velocity": { "radial": [2.4, 2.4], "up": [1.0, 2.6], "ring": true, "ring_jitter_rad": 1 }, "offset": { "up": 0.2 } },
    { "type": "smoke", "count": 14, "delay_ms": [0, 0], "duration_ms": [1800, 2400], "scale": { "base": 0.9, "per_power": 0.4 }, "velocity": { "radial": [3.0, 3.0], "up": [0.4, 0.4], "ring": true }, "tint": 0.9 },
    { "type": "fire", "count": 16, "delay_ms": [450, 300], "duration_ms": [900, 1300], "scale": { "base": 0.22 }, "scale_from": "fireball", "velocity": { "radial": [0, 0], "up": [0.9, 1.5] }, "offset": { "up": 0.3, "scatter": 0.6 }, "low_fraction": 0.5 },
    { "type": "smoke", "count": 36, "delay_ms": [150, 220], "duration_ms": [7000, 10000], "scale": { "base": 1.0, "per_power": 0.4, "rand": 0.9 }, "velocity": { "radial": [0.55, 0.55], "up": [1.4, 2.2] }, "offset": { "up": 0.4, "scatter": 0.6 }, "oil": 1, "low_fraction": 0.5 },
    { "type": "spark", "count": 36, "delay_ms": [0, 8], "duration_ms": [900, 1600], "scale": { "base": 0.05 }, "velocity": { "radial": [1.5, 4.0], "up": [2.0, 5.0] }, "offset": { "up": 0.3 } }
  ],
  "particles": [
    {
      "sprite": "soft_dot",
      "count": [18, 26],
      "lifetime_ms": [280, 620],
      "speed_tiles_s": [4.0, 9.0],
      "cone_deg": 360,
      "gravity_tiles_s2": -1.5,
      "drag": 0.35,
      "size_px": [10, 22],
      "size_over_life": [0.4, 1.0, 1.6],
      "color_over_life": ["vfx.white_hot", "vfx.fire", "vfx.ember"],
      "alpha_over_life": [1.0, 0.9, 0.0],
      "additive": true,
      "heat_shimmer": true,
      "mesh_burst": true
    },
    {
      "sprite": "smoke_puff",
      "count": [10, 16],
      "lifetime_ms": [1800, 3600],
      "emit_over_ms": 900,
      "speed_tiles_s": [0.6, 2.2],
      "cone_deg": 70,
      "gravity_tiles_s2": -0.8,
      "drag": 0.7,
      "size_px": [24, 52],
      "size_over_life": [0.5, 1.4, 2.2],
      "color_over_life": ["shadow.0", "gunmetal.3", "dust.3"],
      "alpha_over_life": [0.85, 0.55, 0.0],
      "mesh_plume": true
    },
    {
      "sprite": "shard",
      "count": [8, 14],
      "lifetime_ms": [500, 1100],
      "speed_tiles_s": [6.0, 13.0],
      "cone_deg": 360,
      "inherit_velocity": 0.2,
      "gravity_tiles_s2": 9.8,
      "size_px": [3, 7],
      "color_over_life": ["vfx.ember", "gunmetal.2"],
      "alpha_over_life": [1.0, 1.0, 0.0]
    }
  ]
}
