{
  "id": "smoke_discharge",
  "trigger": "smoke_screen",
  "layer": "above_units",
  "budget_priority": 4,
  "particles": [
    {
      "sprite": "hard_dot",
      "count": [2, 3],
      "lifetime_ms": [70, 120],
      "speed_tiles_s": [1.0, 2.0],
      "cone_deg": 40,
      "size_px": [3, 5],
      "size_over_life": [1.0, 0.5],
      "color_over_life": ["vfx.white_hot", "vfx.fire"],
      "alpha_over_life": [1.0, 0.0],
      "additive": true
    },
    {
      "sprite": "smoke_puff",
      "count": [4, 6],
      "lifetime_ms": [600, 950],
      "speed_tiles_s": [1.2, 2.4],
      "cone_deg": 60,
      "drag": 0.75,
      "size_px": [6, 10],
      "size_over_life": [0.5, 1.6, 2.2],
      "color_over_life": ["gunmetal.0", "limestone.1"],
      "alpha_over_life": [0.85, 0.5, 0.0]
    }
  ]
}
